{
  "eventId": "650e8400-e29b-41d4-a716-446655440004",
  "matchId": "11111111-2222-3333-4444-555555555555",
  "type": "FOUL_COMMITTED",
  "occurredAt": "2026-04-28T12:09:00Z",
  "matchTime": { "minute": 9, "second": 0, "period": "FIRST_HALF" },
  "payload": {
    "playerId": "00000000-0000-0000-0000-000000000005",
    "teamId": "aaaaaaaa-bbbb-cccc-dddd-eeeeeeeeeeee",
    "againstPlayerId": "00000000-0000-0000-0000-000000000007"
  }
}
