{
  "eventId": "650e8400-e29b-41d4-a716-446655440006",
  "matchId": "11111111-2222-3333-4444-555555555555",
  "type": "SAVE_MADE",
  "occurredAt": "2026-04-28T12:05:13Z",
  "matchTime": { "minute": 5, "second": 13, "period": "FIRST_HALF" },
  "payload": {
    "keeperId": "00000000-0000-0000-0000-000000000006",
    "keeperTeamId": "ffffffff-eeee-dddd-cccc-bbbbbbbbbbbb",
    "relatedShotEventId": "650e8400-e29b-41d4-a716-446655440003"
  }
}
